<!ELEMENT adivinanzas (adivinanza+)>
<!ELEMENT adivinanza (titulo, texto, solucion, imagen)>
<!ATTLIST adivinanza
          id CDATA #REQUIRED>
<!ELEMENT titulo (#PCDATA)>
<!ELEMENT texto (#PCDATA)>
<!ELEMENT solucion (#PCDATA)>
<!ELEMENT imagen (#PCDATA)>
